{
  "$schema": "https://json-schema.org/draft/2020-12/schema",
  "x_schema_version": "ai-assisted-case-summary/v1",
  "title": "AiAssistedCaseSummary",
  "type": "object",
  "additionalProperties": false,
  "required": [
    "case_id",
    "summary",
    "likely_causes",
    "uncertainty_notes",
    "suggested_next_steps",
    "human_verification",
    "scope_guardrail"
  ],
  "properties": {
    "case_id": {
      "type": "string",
      "minLength": 1
    },
    "summary": {
      "type": "string",
      "minLength": 1
    },
    "likely_causes": {
      "type": "array",
      "minItems": 1,
      "maxItems": 3,
      "items": {
        "type": "string",
        "minLength": 1
      }
    },
    "uncertainty_notes": {
      "type": "array",
      "minItems": 1,
      "items": {
        "type": "string",
        "minLength": 1
      }
    },
    "suggested_next_steps": {
      "type": "array",
      "minItems": 1,
      "maxItems": 4,
      "items": {
        "type": "string",
        "minLength": 1
      }
    },
    "human_verification": {
      "type": "string",
      "enum": [
        "required"
      ]
    },
    "scope_guardrail": {
      "type": "string",
      "enum": [
        "no_final_incident_decision|no_rule_changes|no_automated_actions"
      ]
    }
  }
}
